{
  "id": "FL-2026-04-12-002",
  "date": "2026-04-12",
  "repo": "pharmanavi",
  "commit": "9f02a17",
  "intent": "LP修正を本番反映する",
  "mismatch_type": "release_process_gap",
  "symptom": "コミット済みだがpush失敗で未反映状態になった",
  "root_cause": "commit完了を反映完了と誤認し、push到達確認を標準化していなかった",
  "detection": "ユーザーから『デプロイされてない』指摘",
  "fix": "push失敗時は再試行し、originの更新を確認する運用へ変更",
  "preventive_rule": "反映作業は commit->push->origin確認 を必須チェックにする",
  "severity": "S2",
  "cost": {
    "minutes": 20,
    "impact": "反映遅延と再確認コスト"
  },
  "tags": ["release", "git", "deploy"],
  "evidence": ["git push logs", "main branch"]
}
